snapshot_date,course_id,title,provider,provider_ort,provider_plz,weiterbildungsart,anzahl_termine,locations,cost_bands,formats,schedules,next_start,start_dates,description
2026-06-08,10384706885,KI-Manager:in Advanced,ecomex GmbH & Co. KG,Berlin,10789,BERUFLICHE_QUALIFIZIERUNG,250,"Bremen; Hamburg; Hannover; Heidelberg, Neckar; Mainz am Rhein",UEBER_5000_BIS_10000_EUR,Blended Learning,Vollzeit,2026-06-07,2026-06-07,"KI-Manager: Weiterbildung für den beruflichen Einsatz von Künstlicher Intelligenz Die Weiterbildung KI-Manager:in Advanced vermittelt grundlegende und anwendungsbezogene Kompetenzen für den professionellen Umgang mit Künstlicher Intelligenz. Teilnehmende lernen, KI-Tools im Arbeitsalltag gezielt einzusetzen, Prozesse zu unterstützen und Einsatzmöglichkeiten von KI in Organisationen systematisch zu bewerten. Der Kurs verbindet technologische Grundlagen, praktische Anwendungen und methodische Ansätze, um ein fundiertes Verständnis für den produktiven und verantwortungsvollen Einsatz von KI zu schaffen. Kursinhalt 1. Mehr Produktivität mit ChatGPT & Co. (2 Wochen) Einführung in gängige KI-Tools wie ChatGPT, Claude und MS Copilot Grundlagen des Prompt Engineerings KI-gestützte Recherche, Dokumentenanalyse und Informationsaufbereitung Unterstützung bei Texterstellung, Überarbeitung, Übersetzung und Qualitätssicherung Erstellung von Präsentationen und visuellen Inhalten mit KI 2. KI-Agenten & Automatisierung (n8n) Grundlagen von KI-Agenten und Automatisierung Einführung in n8n und typische Einsatzfelder Verknüpfung von Tools, Datenquellen und Workflows Entwicklung einfacher automatisierter Abläufe für wiederkehrende Aufgaben 3. Design Thinking mit KI Einführung in nutzerorientierte Innovationsmethoden Analyse von Problemstellungen und Entwicklung von Lösungsansätzen Einsatz von KI bei Ideenfindung, Strukturierung und Prototyping Praktische Anwendung von Design-Thinking-Methoden im KI-Kontext 4. KI-Agenten II (MS Copilot) Vertiefung agentenbasierter Anwendungen im Microsoft-Umfeld Einsatzmöglichkeiten von MS Copilot in Arbeitsprozessen Strukturierung von Aufgaben, Prompts und Abläufen Praxisorientierte Umsetzung typischer Anwendungsfälle 5. Agile Methoden mit KI Grundlagen agiler Arbeitsweisen wie Scrum und Kanban Planung und Priorisierung von Aufgaben mit KI-Unterstützung Backlog-Management, User Stories und iterative Arbeitsprozesse Verbindung agiler Methoden mit KI-gestützter Projektarbeit 6. Vibe Coding Einführung in KI-unterstütztes Programmieren Verständnis grundlegender Code-Strukturen Entwicklung einfacher digitaler Prototypen mit KI-Unterstützung 7. KI-Strategie & -Implementierung Einordnung von KI im Unternehmenskontext Analyse von Einsatzmöglichkeiten, Anforderungen und Rahmenbedingungen Grundlagen zu Implementierung, Governance und verantwortungsvollem Einsatz von KI"
2026-06-08,10369918929,KI-Manager:in Weiterbildung,ecomex GmbH & Co. KG,Berlin,10789,BERUFLICHE_QUALIFIZIERUNG,125,Düsseldorf; Gera; Hamburg; Wuppertal,UEBER_5000_BIS_10000_EUR,Blended Learning,Vollzeit,,,"KI-Manager:in Advanced - Erweiterte Weiterbildung im KI Management Der KI-Manager:in Advanced ist eine achtwöchige Weiterbildung im Bereich Künstliche Intelligenz im Management, die Fach- und Führungskräfte darauf vorbereitet, KI strukturiert, verantwortungsvoll und praxisnah in Organisationen einzusetzen. Im Fokus steht die Anwendung von KI zur Produktivitätssteigerung, Automatisierung, Strategieentwicklung und Begleitung von Veränderungsprozessen. Kursinhalt1. Mehr Produktivität mit ChatGPT & Co. Wie KI-Systeme wie ChatGPT im Arbeitsalltag sinnvoll eingesetzt werden können Ziel: Produktivität steigern, ohne Qualität oder Verantwortung aus den Augen zu verlieren 2. KI-Agenten und Automatisierung Wie KI-gestützte Agenten Aufgaben eigenständig übernehmen können Behandlung von Einsatzfeldern, Grenzen der Automatisierung und organisatorischen Voraussetzungen 3. KI-Strategie und Implementierung Entwicklung, Bewertung und Umsetzung einer KI-Strategie Themen: Zieldefinition, Priorisierung von Use Cases, Risikobewertung und Erfolgskontrolle 4. Design Thinking mit KI Unterstützung kreativer Prozesse durch KI Von der Problemdefinition über Ideenentwicklung bis zur Prototypenerstellung 5. Agile Methoden mit KI Verbindung von agilen Arbeitsweisen mit KI-Unterstützung Planung, Analyse und Dokumentation in agilen Teams 6. Vibe Coding Niedrigschwelliger Zugang zu KI-gestützter Entwicklung Verstehen von Logiken und Arbeiten mit Code-Assistenten 7. KI-Coaching Grundlagen Vorbereitung für das Coaching von Mitarbeitenden, Teams oder Kund:innen Themen: Grundlagen des KI-Coachings, Widerstände, ethische Fragestellungen und Kommunikationsstrategien"
2026-06-08,10375687990,KI-Weiterbildung,ecomex GmbH & Co. KG,Berlin,10789,BERUFLICHE_QUALIFIZIERUNG,125,Berlin; Erlangen; Konstanz; Offenbach am Main; Wiesbaden,UEBER_5000_BIS_10000_EUR,Blended Learning,Vollzeit,,,"KI-Kurs mit Fokus auf KI-Agenten & KI-Automatisierung Kursinhalt1. Mehr Produktivität mit ChatGPT & Co. Wie KI-Systeme wie ChatGPT im Arbeitsalltag sinnvoll eingesetzt werden können Ziel: Produktivität steigern, ohne Qualität oder Verantwortung aus den Augen zu verlieren 2. KI-Agenten und Automatisierung Wie KI-gestützte Agenten Aufgaben eigenständig übernehmen können Behandlung von Einsatzfeldern, Grenzen der Automatisierung und organisatorischen Voraussetzungen 3. KI-Strategie und Implementierung Entwicklung, Bewertung und Umsetzung einer KI-Strategie Themen: Zieldefinition, Priorisierung von Use Cases, Risikobewertung und Erfolgskontrolle 4. Design Thinking mit KI Unterstützung kreativer Prozesse durch KI Von der Problemdefinition über Ideenentwicklung bis zur Prototypenerstellung 5. Agile Methoden mit KI Verbindung von agilen Arbeitsweisen mit KI-Unterstützung Planung, Analyse und Dokumentation in agilen Teams 6. Vibe Coding Niedrigschwelliger Zugang zu KI-gestützter Entwicklung Verstehen von Logiken und Arbeiten mit Code-Assistenten"
2026-06-08,10392832769,Kampagnen Manager für Online Marketing und Social Media,ecomex GmbH & Co. KG,Berlin,10789,BERUFLICHE_QUALIFIZIERUNG,250,Berlin; Esslingen am Neckar; Freiburg im Breisgau; Gera; Hamburg,UEBER_1000_BIS_5000_EUR,Blended Learning,Teilzeit; Vollzeit,,,"Kampagnen Manager für Online Marketing und Social Media: Strategische Planung, Umsetzung und Optimierung digitaler Kampagnen Die Weiterbildung ""Kampagnen Manager für Online Marketing und Social Media"" vermittelt, wie digitale Kampagnen über verschiedene Kanäle strategisch geplant, umgesetzt und optimiert werden können. Es wird gezeigt, wie Online Marketing und Social Media kombiniert werden, um Reichweite zu erweitern, Zielgruppen zu erreichen und messbare Ergebnisse wie Leads und Conversions zu erzielen. Kursinhalt1. Kampagnenstrategien Ziele definieren Zielgruppen analysieren Kampagnen kanalübergreifend steuern 2. Kampagnenaufbau Inhalte und Werbung verzahnen Strategische Planung verstehen 3. Suchmaschinenoptimierung und Werbung Organische Sichtbarkeit erhöhen Bezahlte Reichweite steigern 4. Social Media Advertising Zielgerichtete Kampagnen entwickeln Effizienter Budgeteinsatz und Performance-Verbesserung 5. CRM und Marketing Automatisierung Leads strukturiert aufbauen Kundenbeziehungen systematisch entwickeln Kampagnen entlang der Customer Journey automatisieren 6. Analyse und Weiterentwicklung Fähigkeiten zur Kampagnensteuerung stärken Strategien zur Optimierung erlernen"
2026-06-08,10377228561,Künstliche Intelligenz Weiterbildung,ecomex GmbH & Co. KG,Berlin,10789,BERUFLICHE_QUALIFIZIERUNG,125,"Berlin; Hamburg; Neubrandenburg, Mecklenburg; Offenbach am Main; Stuttgart",UEBER_5000_BIS_10000_EUR,Blended Learning,Vollzeit,,,"Künstliche Intelligenz: Praxisorientierte Weiterbildung zum Einsatz von KI-Tools und -Methoden Die Weiterbildung Künstliche Intelligenz vermittelt praxisnahes Wissen rund um den gezielten Einsatz von KI-Tools und -Methoden im beruflichen Alltag. In 8 Wochen lernen die Teilnehmenden, wie sie Künstliche Intelligenz strategisch nutzen, Prozesse automatisieren und moderne KI-Werkzeuge effektiv einsetzen können. Kursinhalt1. KI im Arbeitsalltag: Text, Recherche, Assistenz Grundlagen gängiger KI-Sprachmodelle Praktischer Einsatz von ChatGPT und vergleichbaren Tools Prompt-Erstellung und Effizienzsteigerung im Arbeitsalltag durch Künstliche Intelligenz 2. Workflow-Automatisierung mit KI: Agenten & Copilot Studio Einführung in KI-Agenten Aufbau und Steuerung automatisierter Workflows mit Microsoft Copilot Studio Prozessoptimierung durch KI-gestützte Automatisierung 3. KI im Unternehmen: Strategie, Einführung, Veränderung Entwicklung und Umsetzung einer unternehmensweiten KI-Strategie Bewertung von KI-Potenzialen Change Management und erfolgreiche Integration von Künstlicher Intelligenz in bestehende Strukturen 4. Innovationsmethoden: Design Thinking unterstützt durch KI Anwendung von Design-Thinking-Methoden in Kombination mit KI-Tools Nutzerzentrierte Problemlösung Ideenentwicklung mit Unterstützung Künstlicher Intelligenz 5. Agiles Arbeiten in KI-Vorhaben: Scrum & Kanban Einsatz agiler Arbeitsweisen in KI-Projekten Scrum und Kanban im Kontext der Künstlichen Intelligenz Weiterbildung Teamarbeit und iterative Entwicklung 6. KI-Agenten in der Praxis: Erweiterte Szenarien & Orchestrierung Vertiefung der Kenntnisse über KI-Agenten Komplexere Anwendungsfälle Weiterführende Automatisierungsszenarien mit Künstlicher Intelligenz 7. KI-gestützte Entwicklung: Low-Code, No-Code & Prototyping Einführung in KI-gestütztes Programmieren No-Code- und Low-Code-Ansätze mit KI-Unterstützung Praktische Anwendung ohne tiefe Programmierkenntnisse"
2026-06-08,10387775800,"Künstliche Intelligenz, Prompt Engineering und IT-Projektmanagement",ecomex GmbH & Co. KG,Berlin,10789,BERUFLICHE_QUALIFIZIERUNG,250,Berlin; Hamburg; Köln,UEBER_1000_BIS_5000_EUR,Blended Learning,Teilzeit; Vollzeit,,,"Künstliche Intelligenz: Weiterbildung in Prompt Engineering und IT-Projektmanagement Die Weiterbildung ""Künstliche Intelligenz, Prompt Engineering und IT-Projektmanagement"" vermittelt dir, wie du digitale Projekte mit Hilfe von KI effizient planst, steuerst und erfolgreich umsetzt. Du lernst, wie du KI-Tools durch gezieltes Prompt Engineering einsetzt, um Prozesse zu strukturieren, Entscheidungen zu unterstützen und Projektarbeit deutlich produktiver zu gestalten. Der Kurs verbindet moderne Projektmanagement-Methoden mit KI-Anwendungen und zeigt dir, wie du digitale Arbeitsprozesse zukunftsorientiert optimierst. Kursinhalt1. KI im Arbeits- und Projektkontext Grundlagen der Künstlichen Intelligenz und Anwendung in digitalen Projekten. 2. Prompt Engineering für Projektarbeit Effektive Nutzung von KI zur Erstellung von Plänen, Analysen und Dokumentationen. 3. Design Thinking mit KI Einsatz von KI zur Unterstützung kreativer Lösungsfindung in Projekten. 4. Agile Methoden mit KI Optimierung von Projektabläufen durch agile Frameworks und KI-Unterstützung. 5. KI-Strategie & Implementierung im Projektmanagement Integration von KI in Projektstrukturen und Unternehmensprozesse. 6. KI-Agenten & Automatisierung im Projektumfeld Automatisierung von Aufgaben und Workflows zur Effizienzsteigerung in Projekten. (Die Inhalte können je nach Kursformat variieren.)"
2026-06-08,10387771756,"Künstliche Intelligenz: Produktives Arbeiten mit ChatGPT, Claude und Gemini",ecomex GmbH & Co. KG,Berlin,10789,BERUFLICHE_QUALIFIZIERUNG,250,"Heilbronn, Neckar; Karlsruhe, Baden; Köln",UEBER_1000_BIS_5000_EUR,Blended Learning,Teilzeit; Vollzeit,,,"Künstliche Intelligenz: Produktives Arbeiten mit ChatGPT, Claude und Gemini Die Weiterbildung ""Künstliche Intelligenz: Produktives Arbeiten mit ChatGPT, Claude und Gemini"" vermittelt dir praxisnah, wie du moderne KI-Tools gezielt einsetzt, um Arbeitsprozesse effizienter zu gestalten, bessere Entscheidungen zu treffen und deine Produktivität nachhaltig zu steigern. Du lernst, wie du KI nicht nur als Werkzeug nutzt, sondern als festen Bestandteil moderner Arbeitsmethoden - von kreativen Prozessen über strukturierte Planung bis hin zur Automatisierung wiederkehrender Aufgaben. Kursinhalt1. Mehr Produktivität mit ChatGPT & Co. Effiziente Nutzung von KI-Tools zur Unterstützung von Textarbeit Ideenfindung und täglichen Arbeitsprozessen 2. Design Thinking mit KI Einsatz von KI zur Unterstützung kreativer Problemlösungsprozesse Innovativer Ideenentwicklung 3. Agile Methoden mit KI Optimierung von Projekten durch KI-gestützte agile Arbeitsweisen Moderne Teamstrukturen 4. KI-Strategie & Implementierung Entwicklung und Integration von KI in moderne Arbeits- und Unternehmensprozesse Effizienzsteigerung 5. KI-Agenten & Automatisierung Nutzung und Aufbau von KI-gestützten Systemen Automatisierung wiederkehrender Aufgaben und Workflows (Die Inhalte können je nach Kursformat variieren.)"
2026-06-08,10387777670,Marketing Aufbaukurs - E-Commerce,ecomex GmbH & Co. KG,Berlin,10789,BERUFLICHE_QUALIFIZIERUNG,250,"Esslingen am Neckar; Landshut, Isar; Leipzig; München",UEBER_1000_BIS_5000_EUR,Blended Learning,Teilzeit; Vollzeit,,,"Marketing Aufbaukurs: E-Commerce Weiterbildung zur Vertiefung im Online Marketing Diese Weiterbildung richtet sich an alle, die digitale Geschäftsmodelle nicht nur verstehen, sondern gezielt auf ein strategisch höheres Niveau entwickeln und skalieren möchten. Durch den Einsatz von Künstlicher Intelligenz lernst du, wie moderne E-Commerce-Strukturen effizient aufgebaut, gesteuert und kontinuierlich optimiert werden. Der Fokus liegt auf der Verbindung von strategischem E-Commerce, Performance Marketing und KI-gestützter Automatisierung. Ziel ist es, Entscheidungen datenbasiert zu treffen, Prozesse zu verschlanken und nachhaltiges Wachstum im digitalen Handel zu ermöglichen. Nach der Weiterbildung bist du in der Lage, E-Commerce nicht nur operativ zu begleiten, sondern aktiv strategisch zu gestalten. Du entwickelst skalierbare Geschäftsmodelle, optimierst Marketing- und Verkaufsprozesse und nutzt KI gezielt zur Steigerung von Effizienz, Reichweite und Conversion. Kursinhalt1. Online Marketing Strategie Vertiefung strategischer Grundlagen für E-Commerce und digitale Geschäftsmodelle. 2. Website Marketing & Online-Recht Optimierung von Online Shops sowie rechtliche Grundlagen im digitalen Handel. 3. Content Marketing & Social Media I Strategische Content-Erstellung und Social Media Marketing für E-Commerce. 4. Suchmaschinenoptimierung (SEO) Verbesserung der organischen Sichtbarkeit von E-Commerce Plattformen. 5. CRM & Marketing Automatisierung Kundenmanagement und automatisierte Marketingprozesse für nachhaltiges Wachstum. 6. Suchmaschinenwerbung (SEA) Performance Kampagnen zur gezielten Kundengewinnung und Skalierung. 7. Social Media Advertising Optimierung von bezahlten Werbekampagnen auf Social Media Plattformen. 8. E-Commerce - Webshops & Marktplätze Vertiefung von Online Shop Strukturen und digitalen Verkaufskanälen. 9. Analyse & Optimierung Datenanalyse, KPI-Tracking und kontinuierliche Performance-Steigerung. (Die Inhalte können je nach Kursformat variieren.)"
2026-06-08,10392838631,Marketing Automation Tools in der Praxis,ecomex GmbH & Co. KG,Berlin,10789,BERUFLICHE_QUALIFIZIERUNG,250,Berlin; Bonn; Düsseldorf; Landau in der Pfalz; München,UEBER_1000_BIS_5000_EUR,Blended Learning,Teilzeit; Vollzeit,,,"Der Kurs Marketing Automation Tools in der Praxis vermittelt, wie digitale Marketingprozesse mit CRM- und Automation-Tools geplant, umgesetzt und optimiert werden können. Im Mittelpunkt stehen automatisierte Workflows, E-Mail-Marketing, Lead Management, Customer Journey und der effektive Einsatz von Kundendaten. Kursinhalte CRM & Marketing Automation Grundlagen Customer Journey und automatisierte Prozesse E-Mail-Marketing und Newsletter Lead Management und Segmentierung Automation-Tools und einfache Workflows Übungen zur Toolauswahl und Umsetzung Die Reihenfolge der Inhalte kann variieren. Nach Abschluss können die Teilnehmenden Marketing-Automation-Prozesse einordnen, einfache Workflows planen, Kundendaten strukturierter nutzen und geeignete Tools für Marketing- und Vertriebsprozesse auswählen."
2026-06-08,10392839434,Marketing mit KI starten -- Schritt für Schritt,ecomex GmbH & Co. KG,Berlin,10789,BERUFLICHE_QUALIFIZIERUNG,250,"Erlangen; Freiburg im Breisgau; Gummersbach; Heidelberg, Neckar; Leverkusen",UEBER_1000_BIS_5000_EUR,Blended Learning,Teilzeit; Vollzeit,,,"Die Veranstaltung ""Marketing mit KI starten - Schritt für Schritt"" bietet einen strukturierten Einstieg in den Einsatz von Künstlicher Intelligenz im Marketing. Die Teilnehmenden lernen, wie KI-Tools wie ChatGPT, Copilot, Claude oder Gemini bei verschiedenen Marketingaufgaben eingesetzt werden können. Im Fokus stehen Grundlagen, spezifische Anwendungsfälle und praktische Übungen für den Arbeitsalltag. Die Teilnehmenden erfahren, wie KI bei Recherche, Ideenentwicklung, Texten, Content-Planung, Social Media, Präsentationen und grundlegenden Analysen genutzt werden kann. Kursinhalte Grundlagen von KI im Marketing Überblick über ChatGPT, Copilot, Claude und Gemini Prompting für bessere Ergebnisse KI für Recherche und Ideenentwicklung KI für Texte, Social Media und Content-Planung KI für Präsentationen und einfache Auswertungen Qualitätsprüfung und verantwortungsvoller KI-Einsatz Praxisübungen für den sofortigen Einsatz Die Reihenfolge der Inhalte kann variieren. Nach Abschluss können die Teilnehmenden KI-Tools besser einordnen, grundlegende Marketingaufgaben mit KI-Unterstützung umsetzen und Ergebnisse kritisch prüfen."
2026-06-08,10395152950,Marketing: Contenterstellung mit KI,ecomex GmbH & Co. KG,Berlin,10789,BERUFLICHE_QUALIFIZIERUNG,250,Aschaffenburg; Berlin; Düsseldorf; Konstanz; Köln,UEBER_1000_BIS_5000_EUR,Blended Learning,Teilzeit; Vollzeit,,,"Der Kurs ""Marketing: Contenterstellung mit KI"" vermittelt, wie Künstliche Intelligenz bei der Planung, Erstellung und Optimierung von Marketinginhalten eingesetzt werden kann. Die Teilnehmenden lernen, KI-Tools für Recherche, Ideenentwicklung, Textvarianten, Social-Media-Inhalte, Website-Texte, Newsletter und Kampagnenideen zu nutzen. Im Fokus steht die Anwendung im Marketingalltag: Inhalte entwickeln, Prompts formulieren, KI-Ergebnisse prüfen und Content entsprechend Zielgruppe, Kanal und Tonalität weiterverarbeiten. Nach Abschluss können die Teilnehmenden KI-Tools für die Content-Erstellung nutzen und Marketinginhalte vorbereiten."
2026-06-08,10395154243,Marketingstrategie mit KI,ecomex GmbH & Co. KG,Berlin,10789,BERUFLICHE_QUALIFIZIERUNG,250,Düsseldorf; Hannover; Magdeburg; München,UEBER_1000_BIS_5000_EUR,Blended Learning,Teilzeit; Vollzeit,,,"Der Kurs ""Marketingstrategie mit KI"" vermittelt, wie Künstliche Intelligenz bei der Entwicklung, Planung und Optimierung von Marketingstrategien eingesetzt werden kann. Die Teilnehmenden lernen, KI-Tools für Zielgruppenanalyse, Markt- und Wettbewerbsrecherche, Ideenentwicklung, Kanalwahl, Maßnahmenplanung und strategische Entscheidungsprozesse zu nutzen. Im Fokus steht die Verbindung von Marketingverständnis und KI-Anwendung: Strategien strukturieren, relevante Daten einordnen, Kampagnenideen entwickeln und KI-Ergebnisse überprüfen. Nach Abschluss können die Teilnehmenden KI-Tools gezielt einsetzen, um Marketingstrategien fundierter und effizienter zu entwickeln."
2026-06-08,10387774799,Marketingstrategie mit KI und Prompt Engineering,ecomex GmbH & Co. KG,Berlin,10789,BERUFLICHE_QUALIFIZIERUNG,250,"Berlin; Freiburg im Breisgau; Iserlohn; Nürnberg, Mittelfranken; Wiesbaden",UEBER_1000_BIS_5000_EUR,Blended Learning,Teilzeit; Vollzeit,,,"Marketingstrategie mit Künstliche IntelligenzI: Effektive Entwicklung und Umsetzung moderner Marketingstrategien Die Weiterbildung ""Marketingstrategie mit KI und Prompt Engineering"" vermittelt dir, wie du moderne Marketingstrategien mit Hilfe von Künstlicher Intelligenz entwickelst, strukturierst und effizient umsetzt. Du lernst, wie du KI-Tools durch gezieltes Prompt Engineering steuerst, um fundierte Marktanalysen zu erstellen, Zielgruppen besser zu verstehen und datenbasierte Entscheidungen im Marketing zu treffen. Der Fokus liegt auf der Kombination von strategischem Marketingdenken und praktischer KI-Anwendung, um Kampagnen und Maßnahmen deutlich effizienter zu planen und zu optimieren. Kursinhalt1. Online Marketing Strategie mit KI Grundlagen moderner Marketingstrategien Einsatz von KI in der strategischen Planung 2. Prompt Engineering für Strategie & Analyse Gezielte Steuerung von KI Erstellung von Analysen, Ideen und strategischen Konzepten 3. KI-gestützte Zielgruppenanalyse Verständnis und Segmentierung von Zielgruppen Datenbasierte KI-Methoden 4. Content & Kommunikationsstrategie mit KI Entwicklung von Content-Strategien Kommunikationskonzepte mit KI-Unterstützung 5. Kampagnenplanung mit KI Strukturierung von Marketingkampagnen Optimierung durch KI-basierte Systeme 6. Performance Marketing & Optimierung mit KI Analyse von Kampagnendaten Kontinuierliche Verbesserung von Marketingmaßnahmen 7. KI-Agenten & Automatisierung im Marketing Einführung in automatisierte Workflows KI-gestützte Marketingprozesse 8. Projektmanagement & KI im Marketing Planung strategischer Marketingprojekte Umsetzung mit KI-Unterstützung (Die Inhalte können je nach Kursformat variieren.)"
2026-06-08,10392834802,Online Advertising Manager KI,ecomex GmbH & Co. KG,Berlin,10789,BERUFLICHE_QUALIFIZIERUNG,250,"Bonn; Gummersbach; Hamburg; Konstanz; Münster, Westfalen",UEBER_1000_BIS_5000_EUR,Blended Learning,Teilzeit,,,"Online Advertising Manager KI Die Weiterbildung **Online Advertising Manager KI** vermittelt praxisnahes Wissen für die Planung, Umsetzung und Auswertung bezahlter digitaler Werbekampagnen. Im Fokus stehen Google Ads, Social Media Advertising, Performance Marketing und der gezielte Einsatz von Künstlicher Intelligenz im Kampagnenprozess. Die Teilnehmenden lernen, Werbeziele zu definieren, Zielgruppen zu analysieren und passende Kanäle für digitale Kampagnen auszuwählen. Sie beschäftigen sich mit den Grundlagen von Online Advertising, Kampagnenstruktur, Budgetplanung, Anzeigenformaten und der Entwicklung überzeugender Werbebotschaften. Google Ads Ein zentraler Bestandteil ist die Arbeit mit **Google Ads**. Die Teilnehmenden erhalten einen Einstieg in Suchkampagnen, Keywords, Anzeigen, Assets, Budgetlogik und grundlegende Optimierungsmöglichkeiten. Ergänzend lernen sie im Bereich **Social Media Advertising**, wie bezahlte Kampagnen auf Plattformen wie Meta, LinkedIn, TikTok oder YouTube geplant und bewertet werden können. Werbetexte, Anzeigenbotschaften & Creatives Im Modul **Werbetexte, Anzeigenbotschaften & Creatives** entwickeln die Teilnehmenden Anzeigenideen, Textvarianten und visuelle Konzepte für unterschiedliche Werbekanäle. Dabei geht es darum, Botschaften klar, zielgruppengerecht und passend zum jeweiligen Kampagnenziel zu formulieren. Analyse, Reporting und Optimierung Ein weiterer Schwerpunkt liegt auf **Analyse, Reporting und Optimierung**. Die Teilnehmenden lernen, Kampagnenergebnisse auszuwerten, Leistungsdaten einzuordnen und daraus konkrete Verbesserungsmaßnahmen abzuleiten. So entsteht ein Verständnis dafür, wie digitale Werbung nicht nur erstellt, sondern laufend gesteuert und verbessert wird. Künstliche Intelligenz Künstliche Intelligenz wird im Kurs als unterstützendes Werkzeug eingesetzt. Die Teilnehmenden erfahren, wie KI bei Zielgruppenrecherche, Keyword-Ideen, Anzeigenvarianten, Creative-Konzepten, Kampagnenstruktur, Reporting und Optimierung helfen kann. Gleichzeitig lernen sie, KI-Ergebnisse kritisch zu prüfen und fachlich sinnvoll einzusetzen. Zielgruppe Die Weiterbildung richtet sich an Personen, die im Online Marketing, Performance Marketing, Social Media Advertising oder digitalen Kampagnenmanagement arbeiten möchten. Nach Abschluss können sie Online-Werbekampagnen planen, begleiten, auswerten und KI gezielt nutzen, um Werbeprozesse effizienter und strukturierter umzusetzen."
2026-06-08,10361929031,Online Advertising im Online Marketing,ecomex GmbH & Co. KG,Berlin,10789,BERUFLICHE_QUALIFIZIERUNG,250,Hamburg; Hannover; Koblenz am Rhein; Leipzig,UEBER_1000_BIS_5000_EUR,Blended Learning,Teilzeit; Vollzeit,,,"Dieser praxisorientierte Kurs vermittelt in acht Wochen alle wichtigen Grundlagen des Online Marketings mit Schwerpunkt auf Online Advertising. Die Teilnehmenden lernen, wie sie digitale Werbekampagnen erfolgreich planen, umsetzen und optimieren - von Google Ads über Social Media Advertising bis hin zu Web Analytics. Ziel ist es, die nötigen Fähigkeiten zu entwickeln, um im modernen digitalen Marketing souverän agieren zu können. Lernziele: die wichtigsten Disziplinen des Online Marketings sicher einordnen und anwenden professionelle Kampagnen in Google Ads erstellen zielgerichtete Social Media Ads auf Plattformen wie Meta, Instagram und LinkedIn schalten Budget, Zielgruppen und Werbemittel im Online Advertising strategisch planen Kampagnenergebnisse mit Analytics-Tools messen, verstehen und optimieren datenbasierte Entscheidungen treffen und Performance Marketing nachvollziehbar steuern Nach erfolgreicher Teilnahme erhalten die Teilnehmenden ein Zertifikat, das ihre erworbenen Kompetenzen im Online Marketing und Online Advertising belegt."
