snapshot_date,course_id,title,provider,provider_ort,provider_plz,weiterbildungsart,anzahl_termine,locations,cost_bands,formats,schedules,next_start,start_dates,description
2026-06-08,10392832404,Performance Kampagnen Manager,ecomex GmbH & Co. KG,Berlin,10789,BERUFLICHE_QUALIFIZIERUNG,250,"Hamburg; Landshut, Isar; Mannheim; München; Nürnberg, Mittelfranken",UEBER_1000_BIS_5000_EUR,Blended Learning,Teilzeit; Vollzeit,,,"Performance Kampagnen Manager Die Weiterbildung ""Performance Kampagnen Manager"" vermittelt dir praxisnah, wie du datengetriebene Marketingkampagnen strategisch planst, umsetzt und kontinuierlich optimierst. Du lernst, wie du Kampagnen so ausrichtest, dass sie messbare Ergebnisse wie Klicks, Leads und Conversions erzielen und dein Marketingbudget effizient eingesetzt wird. Entwicklung performanceorientierter Kampagnenstrategien Ein Schwerpunkt liegt auf der Entwicklung performanceorientierter Kampagnenstrategien, bei denen du lernst, klare Ziele zu definieren, Zielgruppen präzise zu analysieren und Kampagnen über verschiedene Kanäle hinweg systematisch zu steuern. Suchmaschinenwerbung und Social Media Advertising Darüber hinaus lernst du, wie du Suchmaschinenwerbung und Social Media Advertising gezielt einsetzt, um Reichweite aufzubauen und Kampagnen auf Conversion und ROI zu optimieren. Du verstehst, wie Anzeigenstrukturen funktionieren, wie du Budgets steuerst und wie du Kampagnen kontinuierlich verbesserst. Suchmaschinenoptimierung Ein weiterer Bestandteil ist die Suchmaschinenoptimierung, mit der du langfristig organische Sichtbarkeit aufbaust und Performance-Kampagnen sinnvoll ergänzst. Ergänzend dazu lernst du CRM und Marketing Automatisierung, um Leads effizient zu verwalten, Nutzer entlang der Customer Journey zu begleiten und Kampagnen skalierbar zu gestalten. Verbindung von Strategie und Analyse Die Weiterbildung verbindet Strategie, Analyse und operative Umsetzung und vermittelt dir alle wichtigen Fähigkeiten, um Marketingkampagnen performanceorientiert zu steuern, datenbasiert zu optimieren und nachhaltig zu skalieren."
2026-06-08,10338428159,Performance Marketing Experte,ecomex GmbH & Co. KG,Berlin,10789,BERUFLICHE_QUALIFIZIERUNG,500,Berlin; Erfurt; Hamburg; Hannover,UEBER_1000_BIS_5000_EUR,Blended Learning,Vollzeit,2026-06-28,2026-06-28,"Modul 1: Suchmaschinenoptimierung (SEO) Definition SEO & Position von SEO im Online Marketing Wie funktioniert eine Suchmaschine, SERPs und Nutzerintention Die wichtigsten SEO Faktoren, Keyword Recherche und Sichtbarkeit Maßnahmen zur On-Page-Optimierung für Websites Technical SEO, Crawling & Indexierung Off-Page SEO: Linkbuilding, Linkprofil und Linkaudit Relaunch-Planung, Local SEO, Internationales SEO Arbeiten mit Tools wie Sistrix, Search Console, u.v.m. Täglich praktische Übungen & praxisbewährte Templates zu den o.g. Inhalten Modul 2: CRM & Marketing Automation Grundlagen CRM & Marketing Automation Die Customer Journey mit automatisierten Prozessen managen Der Marketing & Sales Channel Mix in B2C & B2B Möglichkeiten der Automation & die Bedeutung von E-Mail Übersicht CRM & Automation Tools Der B2B Sales Prozess & Inbound Marketing Personas der B2B Kunden & das Buying Center Content im Inbound Marketing & der Einsatz von KI Erfolgreiche Landing Pages für Inbound Kampagnen Die Bedeutung von E-Mail Marketing Verteileraufbau, Newsletter Design & Best Practices Lead Management, Lead Scoring & CRM Insights Das perfekte LinkedIn Profil & Möglichkeiten des Sales Navigator Sales Intelligence & Predictive Selling Die richtige Toolauswahl für dein Projekt Modul 3: Suchmaschinenwerbung (SEA) Einführung SEA & Google Ads-Werbenetzwerk Das Auktionsverfahren Kennzahlen verstehen & Ziele definieren Die strukturierte Keywordrecherche & Keyword-Optionen Einführung in das Google Ads-Konto Aufbau des Google Ads-Kontos Erstellung der Kampagnenstruktur Die erste Google Ads Kampagne einrichten Anzeigenerweiterungen & -optimierung Der Qualitätsfaktor & andere wichtige Metriken Google Display, Shopping & YouTube Best Practice Kampagnen auf den Google-Kanälen Performance Max Kampagnen Kampagnenanalyse & Übungen Modul 4: Social Media Advertisement Grundlagen Social Media Ads Überblick PPC-Advertising Einführung in den Meta-Kosmos Die Meta Business Suite Einführung Facebook Ads Grundlagen & Struktur von Kampagnen Die Bündelung in Anzeigengruppen Zielgruppen & Facebook Audience Insights Facebook Tracking & Optimierung Übersicht zu weiteren Plattformen Aufgabe: Kampagnenerstellung für ein Unternehmen Einführung in die Mediaplanung Die Reihenfolge der Module kann variieren. WAS DU VON UNS ERWARTEN KANNST: Vermittlung von aktuellem und praxisnahem Know-how Dozierende mit angewandter Berufserfahrung Praktische Übungen, Diskussionen und Tipps & Tricks der Dozierenden Teilnahmezertifikat und zusätzliche Zertifizierung durch eine Abschlussprüfung Individuelle Coachingstunde zur Orientierung bei der Jobwahl Auf Wunsch Verleih von Schulungsequipment, wie z. B. Laptop, Monitor, Kamera"
2026-06-08,10338424756,Performance Marketing Manager,ecomex GmbH & Co. KG,Berlin,10789,BERUFLICHE_QUALIFIZIERUNG,500,"Hamburg; Landshut, Isar; Leipzig; Stuttgart",UEBER_5000_BIS_10000_EUR,Blended Learning,Vollzeit,2026-06-14,2026-06-14,"Performance Marketing Management: Weiterbildung zum Applied Performance Marketing Manager INHALTE: In diesem Kurs erhältst du in 8 Modulen die Grundlagen zum Performance Marketing Management. Mit der Weiterbildung kannst du dich als Quereinsteiger für einen Job im Performance Marketing Management fit machen. Performance Marketing Management: Weiterbildung zum Applied Performance Marketing Manager INHALTE: In diesem Kurs erhältst du in 8 Modulen die Grundlagen zum Performance Marketing Management. Mit der Weiterbildung kannst du dich als Quereinsteiger für einen Job im Performance Marketing Management fit machen. Die Highlights der Weiterbildung im Performance Marketing Management: Modul 1: Online-Marketing-Strategie im Performance Marketing Management Status Quo & Trends im Online Marketing Strategische Produktentwicklung (Value Proposition Design, Business Model Canvas) & Markenpositionierung (Customer Journey Analyse, Personas, S.W.O.T., Porters 5 Kräfte-Modell u.a.) Übersicht Online Marketing Kanäle: Vor- & Nachteile, Marketingkonzept, KPI-Definition, Budgeterstellung, Kampagnenentwicklung & Mediaplanung Der Einsatz von Künstlicher Intelligenz (KI) im Online Marketing Modul 2: Website Marketing / Online-Recht im Performance Marketing Management Technische Grundlagen des WWW Ziele & Scope der Websiteerstellung Zielgruppen & Personas Customer Journey Mapping UX-Design, Layout & Performance-Faktoren Grundlagen des Online Rechts Einführung in das Domain- & Markenrecht DSGVO & Einschränkung der Datenverarbeitung Modul 3: Suchmaschinenoptimierung (SEO) und Performance Marketing Management Definition SEO & Position von SEO im Online Marketing Wie funktioniert eine Suchmaschine, SERPs und Nutzerintention Die wichtigsten SEO Faktoren, Keyword Recherche und Sichtbarkeit Technical SEO, Crawling & Indexierung Off-Page SEO: Linkbuilding, Linkprofil und Linkaudit Modul 4: CRM & Marketing Automation im Performance Marketing Management Grundlagen CRM & Marketing Automation Die Customer Journey mit automatisierten Prozessen managen Der Marketing & Sales Channel Mix in B2C & B2B Möglichkeiten der Automation & die Bedeutung von E-Mail Modul 5: Suchmaschinenwerbung (SEA) und Performance Marketing Management Einführung SEA & Google Ads-Werbenetzwerk Aufbau des Google Ads-Kontos Erstellung der Kampagnenstruktur Die erste Google Ads Kampagne einrichten Modul 6: Social Media Advertisement und Performance Marketing Management Grundlagen Social Media Ads Überblick PPC-Advertising Einführung in den Meta-Kosmos Die Meta Business Suite Modul 7: Analyse & Optimierung im Performance Marketing Management Einführung in die Webanalyse Kompetenzen, Methoden & KPIs Einführung in Measurement Frameworks Modul 8: Projektmanagement & KI im Online Marketing und Performance Marketing Management Einführung Projektmanagement Einführung in den Project Canvas Einführung in Gantt Charts & Software-Tools Welche KI-Tools stehen für Performance Marketing Management aktuell zur Verfügung? Einführung in das Prompt Engineering Abschlusstag (1 Tag) Vorstellung CAPTain-Coaching Reflexion & Überarbeitung des Business Model You Canvas Organisatorisches: Prüfung, Zertifikate & Co. Gemeinsamer Lunch und Networking Die Reihenfolge der Module kann variieren. Was du von der Weiterbildung im Performance Marketing Management erwarten kannst: Vermittlung von aktuellem und praxisnahem Know-how rund um Performance Marketing Management Dozierende mit langjähriger Berufserfahrung Praktische Übungen, Diskussionen und Tipps & Tricks der Dozierenden Teilnahmezertifikat und zusätzliche Zertifizierung durch eine Abschlussprüfung Individuelle Coachingstunde zur Orientierung bei der Jobwahl Auf Wunsch stellen wir Schulungsequipment, wie z. B. Laptop, Monitor, Kamera bereit. Für wen ist die Weiterbildung im Performance Marketing Management geeignet? Quereinsteiger und alle, die sich beruflich neu orientieren wollen. Ist die Weiterbildung förderbar? Ja, du kannst für die Performance Marketing Management Weiterbildung z.B. einen Bildungsgutschein verwenden."
2026-06-08,10392834879,Performance Marketing Manager im E-Commerce mit KI,ecomex GmbH & Co. KG,Berlin,10789,BERUFLICHE_QUALIFIZIERUNG,250,Dresden; Frankfurt am Main; Köln,UEBER_1000_BIS_5000_EUR,Blended Learning,Teilzeit; Vollzeit,,,"Weiterbildung Performance Marketing Manager Die Weiterbildung Performance Marketing Manager im E-Commerce mit KI vermittelt Kenntnisse und praktische Fähigkeiten zur Planung, Umsetzung und Auswertung digitaler Marketingmaßnahmen für Online-Shops und e-commerce-orientierte Geschäftsmodelle. Der Schwerpunkt liegt auf performanceorientierten Werbekanälen, messbaren Kampagnenzielen, Umsatzsteigerung und dem gezielten Einsatz von Künstlicher Intelligenz im Kampagnenprozess. Grundlagen des E-Commerce Die Teilnehmenden lernen Grundlagen des E-Commerce und des Performance Marketings kennen. Sie beschäftigen sich mit Kampagnenzielen, Zielgruppen, Customer Journey, Shop-Traffic, Produktanzeigen, Conversion Tracking und der Bewertung von Kampagnenergebnissen. Dabei wird vermittelt, wie digitale Werbemaßnahmen geplant, gesteuert und anhand von Leistungsdaten optimiert werden. Google Ads und Performance Max Ein Schwerpunkt liegt auf Google Ads, Shopping Ads und Performance Max. Die Teilnehmenden lernen, wie Kampagnen für Produkte und Online-Shops aufgebaut werden, welche Rolle Produktdaten und Feeds spielen und wie Budgets sowie Gebotsstrategien sinnvoll eingesetzt werden. Ergänzend werden bezahlte Kampagnen auf sozialen Plattformen behandelt, insbesondere im Hinblick auf Zielgruppenansprache, Anzeigenformate, Creatives und Produktkommunikation. Analyse und Optimierung Im Bereich Analyse und Optimierung lernen die Teilnehmenden, relevante Kampagnendaten auszuwerten, Ergebnisse einzuordnen und daraus konkrete Maßnahmen zur Verbesserung von Reichweite, Verkäufen und Rentabilität abzuleiten. Künstliche Intelligenz Künstliche Intelligenz wird als unterstützendes Werkzeug eingesetzt. Die Teilnehmenden erfahren, wie KI bei Zielgruppenrecherche, Produkttexten, Anzeigenvarianten, Kampagnenplanung, Reporting und Optimierung unterstützen kann. Zielgruppe Die Weiterbildung richtet sich an Personen, die Tätigkeiten im Performance Marketing, E-Commerce-Marketing, Online Marketing oder digitalen Kampagnenmanagement anstreben. Nach Abschluss können sie performanceorientierte E-Commerce-Kampagnen planen, begleiten, auswerten und KI-gestützte Werkzeuge im Marketingprozess anwenden."
2026-06-08,10338430808,Performance Marketing Masterclass,ecomex GmbH & Co. KG,Berlin,10789,BERUFLICHE_QUALIFIZIERUNG,125,Berlin; Bremen; Dresden; Köln,UEBER_5000_BIS_10000_EUR,Blended Learning,Vollzeit,2026-06-14,2026-06-14,"MASSNAHMEZIEL: Performance Marketing stellt einen wichtigen Teilbereich des Online Marketings dar und ist vergleichbar mit einer modernen Form des Vertriebs. Diese Disziplin wird in erster Linie zur Kundengewinnung eingesetzt, kann aber auch der Kundenbindung dienen. Im Vordergrund des Performance Marketings steht die messbare Reaktion der Nutzer durch den Einsatz zeitgemäßer Onlinemarketinginstrumente. Es geht dabei um eine leistungsbezogene Honorierung der Medien im Rahmen erfolgsbasierter Onlinemarketingmodelle, wie Pay per Click, Pay per Lead oder Per per Sales. Sie hebt sich damit von Marketingmethoden ab, deren Abrechnungsmethode durch Reichweite bestimmt (Abrechnung nach Tausend-Kontakt-Preis) wird. In der zehnwöchigen Weiterbildung zum ""Certified Performance Marketing Manager"" lernen Sie neben den Grundlagen des PPC-Marketings inklusive Suchmaschinenoptimierung auch die Grundlagen der Bild- und Videobearbeitung kennen, um in der Lage zu sein, wirksame Werbemittel selbst anzufertigen und in den jeweiligen Anzeigen-Systemen auszuspielen. INHALTE: Modul 1: Grundlagen und Strategie Status Quo & Trends im Online Marketing (4 P, Marketing 5.0 u.a.) Einführung ecomex 6P: Die Basis für langfristigen Erfolg als Marketer/ Skillprofil des modernen Marketers Strategische Produktentwicklung (Value Proposition Design, Business Model Canvas) & Markenpositionierung (Customer Journey Analyse, Personas, S.W.O.T., Konkurrenzanalyse u.a.) Übersicht Online Marketing Kanäle: Vor- & Nachteile, Marketingkonzept, Budgeterstellung, Kampagnenentwicklung & Mediaplanung Agile Arbeitsprozesse, Kooperation im Unternehmen/ mit Dienstleister (Definition SCRUM, Product Owner, UX Designer) Schritte zur optimalen Technologie-Plattform (Definition Martech, Build or Buy, MVP, Marketing Automation) Analyse & Optimierung: Tracking-Techniken, Datenquellen & Analysetools (Google Analytics u.a.) Tägliche praktische Übungen & praxisbewährte Templates zu den o.g. Inhalten Modul 2: Suchmaschinenoptimierung (SEO) Definition SEO & Position von SEO im Online Marketing Wie funktioniert eine Suchmaschine, SERPs und Nutzerintention Die 4 wichtigen SEO Faktoren, Keyword Recherche und Sichtbarkeit Maßnahmen zur OnPage-Optimierung für Websites Technical SEO, Crawling & Indexierung OffPage: Linkbuilding, Linkprofil und Linkaudit Relaunch, Local SEO, Internationales SEO Übung: SEO Analyse, Technical SEO Audit, Content Briefing aus SEO-Sicht, SEO-Maßnahmeplan Arbeiten mit Tools wie Sistrix, Search Console, u.v.m. Tägliche praktische Übungen & praxisbewährte Templates zu den o.g. Inhalten Modul 3: Suchmaschinenwerbung (SEA) Einführung in das Suchmaschinenmarketing & Google Ads-Werbenetzwerk Erstellung eines Google Ads-Kontos & Einrichtung erster SEA-Kampagnen Aufbau des Google Ads-Kontos & Erstellung der Kampagnenstruktur Keywordrecherche, Budget & Gebote, & Kampagneneinstellungen Best Practices und Redaktionelle Anforderungen für Google Ads-Anzeigen Die Bedeutung des Qualitätsfaktors & andere Schlüssel Metriken Conversion-Tracking einrichten Weitere Google Kanäle: Anzeigen im Google Display Netzwerk, Produkte in Google Shopping & Videokampagnen in YouTube (inkl. Erstellung von Kampagnen) Analyse & Optimierung von Kampagnen Tägliche praktische Übungen & praxisbewährte Templates zu den o.g. Inhalten Modul 4: Social Media Marketing Einführung, Definition und strategisches Arbeiten mit Social Media Qualitative und quantitative (SMART-)Ziele für Social Media Monitoring, Social Media Algorithmen, Follower-Aufbau und Reichweitenerhöhung Umgang mit Trollen, Bots, Bewertungen und Rezensionen in Social Media Erstellung von Content für Social Media (u.a. mit Canva) Kanalarbeit in Facebook, u.a. mit Unternehmensseite, Funktionalitäten, Beitragsformate, Statistiken Kanalarbeit in Instagram, u.a mit Instagram Feed, Stories, Product Placement Kanalarbeit in Twitter, u.a mit Twitter-Feed, Trending Topics Kanalarbeit in XING und LinkedIn, u.a. mit ""Persönliche Profile"" vs. Unternehmensprofile, Profiloptimierung, Arbeiten in/mit Gruppen Umsetzung von Redaktionsplänen, Dos and Don’ts, Kundenkommunikation / Kundensupport Tägliche praktische Übungen & praxisbewährte Templates zu den o.g. Inhalten Modul 5: Social Media Advertisement Grundlagen der Social-Media Werbung Einführung in den Facebook-Kosmos (Werbeanzeigenmanager, Business Manager, weitere Produkte) Grundlagen und Struktur von Kampagnen und Anzeigengruppen Zielgruppen & FB Audience Insights Der Facebook Pixel und Retargeting Grundlagen und Struktur von Anzeigen Wirkung und Erstellung von Werbemitteln Auswertung & Optimierung von Kampagnen Werben auf anderen Social-Media-Plattformen Tägliche praktische Übungen & praxisbewährte Templates zu den o.g. Inhalten Modul 6: Content Marketing Creative Content Marketing: Golden Cycle & Core-Story Limbic Map, Positionierung, 5 ""Why” und Relevanz Help Hub Hero Content, Content Matrix, Content Stacking & Lead-Magnets Content Marketing und angrenzende Themengebiete: Social Listening / Monitoring / Analyzing / SEO Content Marketing als Inbound Marketing Prozess: von Push zu Pull Marketing Content Audit, Planung, Produktion und Management Customer Relationship Management (CRM) Tägliche praktische Übungen & praxisbewährte Templates zu den o.g. Inhalten Modul 7: Analyse & Optimierung Einführung in Webanalyse Kompetenzen & Methoden Definition von Kennzahlen und KPIs anhand eines Measurement Frameworks Grundlagen von Google Analytics & Google Tag Manager inkl. praktische Einbindung in eine Website Einstieg in das Ereignis Tracking, Data Layer & E-Commerce Tracking Unterschiede Google Analytics 4 und Universal Analytics Consent Management, Datenschutz & DSGVO Optimierung mit A/B-Testing in Google Optimize, Hotjar u. a. Tools Growth Hacking, Attributionsmodelle, Personalisierung & Break-Even Analyse Tägliche praktische Übungen & praxisbewährte Templates zu den o.g. Inhalten Modul 8: Bilder fürs Web Einführung in die Bildgestaltung Foto-Aufgaben umsetzen, Kameratechnik nutzen und ""Fotoblick"" schärfen Bildbearbeitung mit Photoshop, u.a. mit Metadaten und Copyright Bedienoberfläche, Arbeitsbereich, Bildformat, Bildgröße Farb- und Fehlerkorrekturen, Speichern in verschiedenen Dateiformaten Farbkorrekturen, einfache Retusche Bildkorrekturen partiell, Auswahlwerkzeuge, Bildhintergrund, (Un)Schärfe, Ebenen, Textwerkzeug, Freistellen Verschiedene praktische Übungen während des Kurses Adobe Photoshop Lizenz wird für den Zeitraum des Kurses gestellt Modul 9: Video fürs Web Grundlagen der Videoproduktion Konzept und Filmaufbau: Pre, Dreh, Post Nutzungs- und Urheberrechte Gute Drehorte Adobe Premiere: Dreh- und Schnitteinführung Ausgabe eines Films für diverse Plattformen (Social Media, Website etc.) Verschiedene praktische Übungen während des Kurses Adobe Premiere Lizenz wird für den Zeitraum des Kurses gestellt Modul 10: Praxismodul Texten für das Web / Messenger Marketing Einführung in das Modul: Grundlagen Schreiben -Textarten im Web Gute Briefings, mit denen Texter wirklich arbeiten können Website-Unterseite…"
2026-06-08,10391164267,Performance Marketing im Online Marketing,ecomex GmbH & Co. KG,Berlin,10789,BERUFLICHE_QUALIFIZIERUNG,250,Dresden; Hamburg; Konstanz; Köln; Mainz am Rhein,UEBER_1000_BIS_5000_EUR,Blended Learning,Teilzeit; Vollzeit,,,"Performance Marketing: Praktisches Wissen für datengetriebenes Marketing Die Weiterbildung **""Performance Marketing im Online Marketing""** vermittelt praxisnahes Wissen, um datengetriebene Marketingkampagnen zu planen, umzusetzen und kontinuierlich zu optimieren. Im Mittelpunkt steht die messbare Leistung digitaler Maßnahmen mit dem Ziel, Reichweite, Leads und Conversions gezielt zu steigern. Die Teilnehmenden lernen, verschiedene digitale Kanäle strategisch zu kombinieren und mithilfe moderner Tools sowie KI-gestützter Ansätze fundierte Entscheidungen zu treffen. Besonderes Augenmerk liegt auf Suchmaschinenwerbung, Social Media Advertising, Website Marketing, Analyse, CRM und Marketing Automatisierung. Kursinhalt1. Online-Marketing-Strategie Einführung in datenbasierte Marketingstrategien Aufbau klarer Funnel- und Zielstrukturen 2. Suchmaschinenwerbung (SEA) Planung, Umsetzung und Optimierung von Google Ads Kampagnen Keyword-Strategien und Budgetsteuerung 3. Social Media Advertising Erstellung und Steuerung von Paid-Kampagnen Fokus auf Performance auf Plattformen wie Facebook, Instagram und LinkedIn 4. Website Marketing & Online-Recht Optimierung von Websites und Landingpages für bessere Conversion Rates Rechtliche Grundlagen wie DSGVO und Datenschutz 5. Analyse & Optimierung Auswertung von Kampagnendaten KPI-Tracking und Ableitung konkreter Maßnahmen zur kontinuierlichen Performance-Steigerung 6. CRM & Marketing Automatisierung Einführung in Lead Management Customer Journeys und automatisierte Marketingprozesse zur Conversion-Optimierung 7. Projektmanagement & KI im Online Marketing Strukturierte Planung von Kampagnen Einsatz von KI-Tools zur Analyse, Automatisierung und Effizienzsteigerung Die Reihenfolge der Module kann je nach Kursorganisation variieren."
2026-06-08,10395154975,Performance Marketing mit AI Weiterbildung,ecomex GmbH & Co. KG,Berlin,10789,BERUFLICHE_QUALIFIZIERUNG,250,Bremen; Duisburg; Hamburg; Köln,UEBER_5000_BIS_10000_EUR,Blended Learning,Teilzeit; Vollzeit,,,"Die Weiterbildung ""Die Weiterbildung ""Performance Marketing mit AI Weiterbildung"" vermittelt praxisnah, wie digitale Kampagnen datenbasiert geplant, umgesetzt und mit KI-Unterstützung effizienter gestaltet werden können. Die Teilnehmenden lernen, KI-Tools bei Recherche, Kampagnenstruktur, Anzeigenideen, Content-Varianten, Analyse und Optimierung sinnvoll einzusetzen. Kursinhalte: KI im Berufsalltag: ChatGPT, Copilot, Claude und Gemini für Marketingaufgaben Prompting und KI-gestützte Recherche Content-Erstellung und Werbetexte mit KI KI-gestützte Zielgruppenanalyse und Online-Marketing-Strategie Suchmaschinenoptimierung mit KI-Unterstützung Suchmaschinenwerbung und Google Ads Social Media Advertising und Paid Campaigns CRM und Marketing Automation KI-Agenten und Automatisierung im Marketing Analyse, Reporting und datenbasierte Optimierung mit KI Projektmanagement und KI im Online Marketing Die Reihenfolge der Module kann variieren. Nach Abschluss können die Teilnehmenden Performance-Marketing-Maßnahmen planen, Kampagnen auswerten und KI-Tools gezielt einsetzen, um Marketingprozesse effizienter und datenbasierter zu gestalten."""
2026-06-08,10392834433,"Performance Marketing, Google Ads & KI Grundlagen",ecomex GmbH & Co. KG,Berlin,10789,BERUFLICHE_QUALIFIZIERUNG,250,Bonn; Braunschweig; Mannheim; Mönchengladbach; Stuttgart,UEBER_1000_BIS_5000_EUR,Blended Learning,Teilzeit; Vollzeit,,,"Performance Marketing, Google Ads & KI Grundlagen Der Kurs **Performance Marketing, Google Ads & KI Grundlagen** vermittelt einen praxisnahen Einstieg in die Planung, Umsetzung und Bewertung bezahlter Online-Marketing-Kampagnen. Im Mittelpunkt steht Google Ads als zentrales Werkzeug im Performance Marketing. Die Teilnehmenden lernen, wie Kampagnenziele definiert, Anzeigen strukturiert, Budgets sinnvoll eingesetzt und Ergebnisse anhand klarer Leistungsdaten ausgewertet werden. Grundlagen des Performance Marketings Zu Beginn erhalten die Teilnehmenden einen Überblick über die Grundlagen des Performance Marketings. Sie verstehen, was performanceorientierte Werbung auszeichnet und wie sich Maßnahmen wie Suchmaschinenwerbung, Display-Anzeigen, Shopping-Kampagnen oder Performance Max in eine digitale Marketingstrategie einordnen lassen. Der Fokus liegt darauf, digitale Kampagnen nicht nach Gefühl, sondern zielgerichtet, messbar und nachvollziehbar zu steuern. Arbeit mit Google Ads Ein wichtiger Bestandteil des Kurses ist die Arbeit mit Google Ads. Die Teilnehmenden lernen den Aufbau eines Google-Ads-Kontos kennen und erfahren, wie Kampagnen, Anzeigengruppen, Keywords, Anzeigen und Assets sinnvoll strukturiert werden. Behandelt werden typische Kampagnenziele wie Leadgewinnung, Verkäufe, Website-Traffic, Markenbekanntheit sowie Produkt- und Markeninteresse. Dabei wird deutlich, wie stark das gewählte Ziel die Kampagnenstruktur, Gebotsstrategie, Landingpage und Erfolgsmessung beeinflusst. Optimierung von Kampagnen Auch die Optimierung von Kampagnen spielt eine zentrale Rolle. Die Teilnehmenden lernen, Suchbegriffe auszuwerten, Budgets anzupassen, Anzeigenvarianten zu testen und Kampagnen anhand von Leistungsdaten weiterzuentwickeln. Zusätzlich wird vermittelt, warum Conversion Tracking und ein sauberes Messkonzept entscheidend sind, um Kampagnenerfolg realistisch bewerten zu können. Künstliche Intelligenz im Kurs Künstliche Intelligenz wird im Kurs als unterstützendes Werkzeug eingesetzt. Die Teilnehmenden erfahren, wie KI bei Keyword-Ideen, Anzeigenvarianten, Zielgruppenrecherche, Kampagnenstruktur, Reporting und Optimierung helfen kann. Gleichzeitig lernen sie, KI-Ergebnisse kritisch zu prüfen und fachlich sinnvoll einzuordnen. Zielgruppe des Kurses Der Kurs richtet sich an Personen, die einen fundierten Einstieg in Google Ads und Performance Marketing suchen. Nach Abschluss können sie einfache Google-Ads-Kampagnen planen, grundlegende Leistungsdaten interpretieren und KI gezielt zur Unterstützung im Kampagnenprozess nutzen."
